{
  "contract_name": "director-shot-data",
  "contract_version": "3.1.3",
  "source_skill": "su-fenjingskill",
  "source_skill_version": "3.1.3",
  "project_id": "kitchen-farewell-demo",
  "source": {
    "title": "厨房告别",
    "delivery_slug": "kitchen-farewell",
    "input_kind": "screenplay_segment",
    "locked_text": "内景·厨房·夜\n林晓彤把一把钥匙放在餐桌上。\n林晓彤：我明天走。\n陈默继续切菜，刀声停下。\n陈默：什么时候决定的？",
    "dialogue_lines": [
      {
        "dialogue_id": "D001",
        "speaker": "林晓彤",
        "text": "我明天走。",
        "voice_type": "scene_dialogue"
      },
      {
        "dialogue_id": "D002",
        "speaker": "陈默",
        "text": "什么时候决定的？",
        "voice_type": "scene_dialogue"
      }
    ]
  },
  "assumptions": [],
  "director_design": {
    "scene_purpose": "让一段离开宣告从信息变成关系断裂的现实。",
    "dramatic_question": "陈默会继续维持日常秩序，还是承认这句话已经改变两人的关系？",
    "turning_point": "规律刀声在林晓彤说完后停下，陈默第一次无法用动作掩盖反应。",
    "audience_position": "观众先作为厨房里的第三人观察两人，再被刀声停止拉近陈默的身体反应。",
    "pov_strategy": "关系视点逐步偏向承受消息的陈默，但不进入完全主观镜头。",
    "emotional_arc": "表面日常维持——离开信息落下——动作秩序中断——被迫发问。",
    "blocking_strategy": "林晓彤停在餐桌一侧，陈默留在料理台；钥匙处于两人之间，空间距离不变但关系被物件切开。",
    "visual_strategy": "从共享关系构图切到手部细节，再到陈默面孔；每次靠近都由信息对身体的作用触发。",
    "sound_strategy": "用规律切菜声建立日常节拍，让钥匙金属声和突然静默成为真正的情绪转折。",
    "rhythm_strategy": "前镜让动作完整发生，中镜保留台词后的半拍静默，末镜不急切回林晓彤，让问题悬在陈默身上。"
  },
  "scenes": [
    {
      "scene_id": "SC001",
      "scene": "内景·厨房·夜",
      "source_excerpt": "内景·厨房·夜\n林晓彤把一把钥匙放在餐桌上。\n\n林晓彤：我明天走。\n陈默继续切菜，刀声停下。\n\n陈默：什么时候决定的？",
      "space_map": {
        "anchors": [
          "画面左侧餐桌",
          "画面右侧料理台与砧板",
          "两人之间的钥匙"
        ],
        "character_start_positions": [
          "林晓彤站在餐桌靠门一侧",
          "陈默站在料理台前，身体朝向砧板"
        ],
        "axis_notes": "主要关系轴连接餐桌与料理台；三镜保持林晓彤在银幕左侧、陈默在银幕右侧的基本方向。",
        "protected_continuity": [
          "钥匙从林晓彤手中落到餐桌后保持原位",
          "菜刀从持续切菜变为停在砧板上",
          "陈默在发问前不转身面对林晓彤"
        ]
      },
      "lighting_strategy": "以料理台上方实用灯形成陈默侧上方硬光，餐桌区域较暗；不额外制造光线变化，让静默承担转折。",
      "color_strategy": "暖灰厨房为主，钥匙冷色反光作为小面积视觉重心。"
    }
  ],
  "shots": [
    {
      "shot_id": "SH001",
      "scene_id": "SC001",
      "source_excerpt": "内景·厨房·夜\n林晓彤把一把钥匙放在餐桌上。",
      "duration_seconds": 4.5,
      "duration_basis": "建立两人位置约1.5秒，林晓彤抬手与放下钥匙约2秒，金属声后的停留约1秒。",
      "motivation": {
        "primary": "relationship",
        "reason": "先让两人共享同一空间，使钥匙落在中间时成为可见的关系分隔，而不是单纯道具插镜。"
      },
      "camera": {
        "shot_size": "中远景",
        "angle": "平视",
        "position": "厨房入口内侧，斜向同时看见餐桌与料理台",
        "composition": "林晓彤在左侧餐桌旁，陈默在右侧料理台前；中间留出钥匙落点和一段未被跨越的负空间",
        "lens_intent": "自然透视，保留两人真实距离与厨房纵深",
        "movement": {
          "type": "fixed",
          "trigger": "",
          "speed": "",
          "path": "",
          "end_condition": "",
          "reason": "不替任何人靠近，让人物距离和钥匙落点自行改变关系。"
        },
        "focus": "两人和餐桌保持可读，钥匙触桌时允许注意力自然落向画面中部",
        "lighting_change": "",
        "framing_mode": "two_shot",
        "primary_subjects": [
          "林晓彤",
          "陈默"
        ],
        "foreground_subjects": [],
        "shot_size_reason": "中远景同时交代餐桌、料理台和两人之间未跨越的距离。",
        "angle_reason": "平视让离开宣告先发生在未被强调的日常关系中。"
      },
      "staging": {
        "subjects": [
          "林晓彤",
          "陈默",
          "钥匙"
        ],
        "blocking": "陈默保持切菜；林晓彤不靠近他，只向餐桌伸手放下钥匙。",
        "performance": "林晓彤的动作没有解释性停顿；陈默仍维持原有切菜节拍。",
        "visible_subjects": [
          "林晓彤",
          "陈默",
          "钥匙"
        ],
        "offscreen_subjects": []
      },
      "sound": {
        "perspective": "客观厨房空间，菜刀声来自画面右侧，钥匙声来自画面中部偏左。",
        "dialogue_segments": [],
        "effects": [
          "规律的切菜声",
          "钥匙触桌的金属轻响"
        ],
        "ambience": "低声冰箱运转与室内夜间底噪",
        "music": ""
      },
      "edit": {
        "entry": "从场景开始直接进入共享空间。",
        "exit": "钥匙触桌并停稳，陈默的切菜节拍仍未改变。",
        "transition_to_next": "硬切到陈默手部与砧板。"
      },
      "continuity": {
        "axis": "餐桌—料理台关系轴，摄影机保持入口一侧。",
        "screen_direction": "林晓彤保持银幕左侧，陈默保持银幕右侧。",
        "state_updates": [
          {
            "entity": "钥匙",
            "field": "位置",
            "from": "林晓彤手中",
            "to": "餐桌上"
          }
        ],
        "intentional_breaks": []
      },
      "execution_text": "【中远景｜平视｜固定】\n【观看】所有权：人物关系（林晓彤；陈默）；读取：人物关系；摄影机响应：观察；理由：先让两人和钥匙共享空间，使离开信息落到两人之间。\n【摄影】构图类型：双人构图；主要主体：林晓彤；陈默；前景主体：无；机位：厨房入口内侧，斜向同时看见餐桌与料理台；构图：林晓彤在左侧餐桌旁，陈默在右侧料理台前；中间留出钥匙落点和一段未被跨越的负空间；景别：中远景（中远景同时交代餐桌、料理台和两人之间未跨越的距离。）；角度：平视（平视让离开宣告先发生在未被强调的日常关系中。）；镜头意图：自然透视，保留两人真实距离与厨房纵深；运动：固定；理由：不替任何人靠近，让人物距离和钥匙落点自行改变关系。；焦点：两人和餐桌保持可读，钥匙触桌时允许注意力自然落向画面中部；光线变化：无\n【调度与表演】主体：林晓彤；陈默；钥匙；画内：林晓彤；陈默；钥匙；画外：无；调度：陈默保持切菜；林晓彤不靠近他，只向餐桌伸手放下钥匙。；表演：林晓彤的动作没有解释性停顿；陈默仍维持原有切菜节拍。\n【声音】声场：客观厨房空间，菜刀声来自画面右侧，钥匙声来自画面中部偏左。；对白：无；音效：规律的切菜声；钥匙触桌的金属轻响；环境：低声冰箱运转与室内夜间底噪；音乐：无\n【剪辑】入点：从场景开始直接进入共享空间。；出点：钥匙触桌并停稳，陈默的切菜节拍仍未改变。；下一关系：硬切到陈默手部与砧板。\n【连续性】轴线：餐桌—料理台关系轴，摄影机保持入口一侧。；银幕方向：林晓彤保持银幕左侧，陈默保持银幕右侧。；状态变化：钥匙·位置：林晓彤手中→餐桌上；有意违例：无\n【镜头动机】主因：关系；理由：先让两人共享同一空间，使钥匙落在中间时成为可见的关系分隔，而不是单纯道具插镜。；时长依据：建立两人位置约1.5秒，林晓彤抬手与放下钥匙约2秒，金属声后的停留约1秒。",
      "notes": "",
      "shot_flow": [
        {
          "owner": "camera_setup"
        },
        {
          "owner": "blocking"
        },
        {
          "owner": "performance"
        },
        {
          "owner": "effect",
          "index": 0
        },
        {
          "owner": "effect",
          "index": 1
        },
        {
          "owner": "ambience"
        },
        {
          "owner": "focus"
        },
        {
          "owner": "state_update",
          "index": 0
        },
        {
          "owner": "edit_exit"
        }
      ],
      "viewpoint": {
        "owner_type": "relationship",
        "owner_refs": [
          "林晓彤",
          "陈默"
        ],
        "reading_priority": "relationship",
        "camera_response": "observe",
        "reason": "先让两人和钥匙共享空间，使离开信息落到两人之间。"
      }
    },
    {
      "shot_id": "SH002",
      "scene_id": "SC001",
      "source_excerpt": "林晓彤：我明天走。\n陈默继续切菜，刀声停下。",
      "duration_seconds": 5.5,
      "duration_basis": "对白最低可播约1.5秒；切菜继续约1.5秒，刀停与静默反应约2.5秒。",
      "motivation": {
        "primary": "emotion",
        "reason": "不急于看陈默的脸，而让观众先从手部节拍被打断看见消息进入身体。"
      },
      "camera": {
        "shot_size": "近景",
        "angle": "微俯视",
        "position": "料理台外侧偏陈默右肩后方，朝向双手、菜刀与砧板",
        "composition": "陈默的手与菜刀占据画面中心，林晓彤和钥匙均在画外",
        "lens_intent": "隔离手部细节，压低背景信息，让节拍变化成为唯一事件",
        "movement": {
          "type": "fixed",
          "trigger": "",
          "speed": "",
          "path": "",
          "end_condition": "",
          "reason": "固定观看才能让同一动作节拍的中断被准确感知。"
        },
        "focus": "焦点锁在刀刃与陈默握刀的手，刀停后不转移",
        "lighting_change": "刀刃在实用灯下出现短促冷反光",
        "framing_mode": "insert",
        "primary_subjects": [
          "陈默的手",
          "菜刀",
          "砧板"
        ],
        "foreground_subjects": [],
        "shot_size_reason": "近景隔离手、刀和砧板，确保刀声停止能够被准确读取。",
        "angle_reason": "微俯视直接看清刀刃与手的停顿，不把角度用于夸大权力。"
      },
      "staging": {
        "subjects": [
          "陈默",
          "陈默的手",
          "菜刀",
          "砧板",
          "林晓彤"
        ],
        "blocking": "陈默继续原有切菜动作；林晓彤留在画外原位。",
        "performance": "陈默听见离开宣告后不立刻抬头，先让下一刀没有落下，握刀的手停在砧板上方，随后缓慢落回砧板。",
        "visible_subjects": [
          "陈默",
          "陈默的手",
          "菜刀",
          "砧板"
        ],
        "offscreen_subjects": [
          "林晓彤"
        ]
      },
      "sound": {
        "perspective": "贴近砧板的近距离听觉；林晓彤从画外左侧说话，菜刀声由近到突然消失。",
        "dialogue_segments": [
          {
            "dialogue_id": "D001",
            "text": "我明天走。",
            "delivery": "os"
          }
        ],
        "effects": [
          "切菜声在台词落下后停止",
          "菜刀轻触砧板"
        ],
        "ambience": "刀声停止后只剩冰箱低频底噪",
        "music": ""
      },
      "edit": {
        "entry": "接上一镜仍在持续的切菜声切入手部。",
        "exit": "刀停在砧板上，静默持续到观众开始等待陈默回应。",
        "transition_to_next": "硬切到陈默面孔。"
      },
      "continuity": {
        "axis": "仍在入口一侧，不改变两人关系轴。",
        "screen_direction": "陈默身体朝向与上一镜一致。",
        "state_updates": [
          {
            "entity": "菜刀",
            "field": "动作状态",
            "from": "持续切菜",
            "to": "停在砧板上"
          }
        ],
        "intentional_breaks": []
      },
      "execution_text": "【近景｜微俯视｜固定】\n【观看】所有权：物件（陈默的手；菜刀）；读取：细节；摄影机响应：隔离；理由：把画面从双人关系隔离到没有落下的下一刀，让身体先于语言反应。\n【摄影】构图类型：细节插入；主要主体：陈默的手；菜刀；砧板；前景主体：无；机位：料理台外侧偏陈默右肩后方，朝向双手、菜刀与砧板；构图：陈默的手与菜刀占据画面中心，林晓彤和钥匙均在画外；景别：近景（近景隔离手、刀和砧板，确保刀声停止能够被准确读取。）；角度：微俯视（微俯视直接看清刀刃与手的停顿，不把角度用于夸大权力。）；镜头意图：隔离手部细节，压低背景信息，让节拍变化成为唯一事件；运动：固定；理由：固定观看才能让同一动作节拍的中断被准确感知。；焦点：焦点锁在刀刃与陈默握刀的手，刀停后不转移；光线变化：刀刃在实用灯下出现短促冷反光\n【调度与表演】主体：陈默；陈默的手；菜刀；砧板；林晓彤；画内：陈默；陈默的手；菜刀；砧板；画外：林晓彤；调度：陈默继续原有切菜动作；林晓彤留在画外原位。；表演：陈默听见离开宣告后不立刻抬头，先让下一刀没有落下，握刀的手停在砧板上方，随后缓慢落回砧板。\n【声音】声场：贴近砧板的近距离听觉；林晓彤从画外左侧说话，菜刀声由近到突然消失。；对白：D001（画外）：“我明天走。”；音效：切菜声在台词落下后停止；菜刀轻触砧板；环境：刀声停止后只剩冰箱低频底噪；音乐：无\n【剪辑】入点：接上一镜仍在持续的切菜声切入手部。；出点：刀停在砧板上，静默持续到观众开始等待陈默回应。；下一关系：硬切到陈默面孔。\n【连续性】轴线：仍在入口一侧，不改变两人关系轴。；银幕方向：陈默身体朝向与上一镜一致。；状态变化：菜刀·动作状态：持续切菜→停在砧板上；有意违例：无\n【镜头动机】主因：情绪；理由：不急于看陈默的脸，而让观众先从手部节拍被打断看见消息进入身体。；时长依据：对白最低可播约1.5秒；切菜继续约1.5秒，刀停与静默反应约2.5秒。",
      "notes": "",
      "shot_flow": [
        {
          "owner": "camera_setup"
        },
        {
          "owner": "blocking"
        },
        {
          "owner": "performance"
        },
        {
          "owner": "dialogue_segment",
          "index": 0
        },
        {
          "owner": "effect",
          "index": 0
        },
        {
          "owner": "effect",
          "index": 1
        },
        {
          "owner": "ambience"
        },
        {
          "owner": "focus"
        },
        {
          "owner": "state_update",
          "index": 0
        },
        {
          "owner": "edit_exit"
        }
      ],
      "viewpoint": {
        "owner_type": "object",
        "owner_refs": [
          "陈默的手",
          "菜刀"
        ],
        "reading_priority": "detail",
        "camera_response": "isolate",
        "reason": "把画面从双人关系隔离到没有落下的下一刀，让身体先于语言反应。"